"BT458EHQ","book","2016","Benjamin, Andrew E.","Virtue in being : towards an ethics of the unconditioned","","978-1-4384-6163-2","","","","In his last book, Towards a Relational Ontology, Andrew Benjamin provided a philosophical account of what he terms anoriginal relationality, demonstrating how this concept can be seen to be at work throughout the history of philosophy. In Virtue in Being, he builds on that project to argue for a new way of understanding the relationship between ontology and ethics through insightful readings of texts by Immanuel Kant, Hannah Arendt, and Jacques Derrida. Structuring the book around the themes of violence, evil, and pardon, Benjamin builds a convincing case for the connections he draws between thinkers not commonly associated with one another.","2016","2026-02-02 18:47:41","2026-02-02 18:53:06","","","","","","","","","SUNY Series in Contemporary Continental Philosophy","","","","State University of New York Press","Albany, [New York","eng","","","","","","","Publication Title: Virtue in being : towards an ethics of the unconditioned","","","","Ethics; Philosophical anthropology","","","","","","","","","","","","","","","","","","","","","","","","","","","","","","","","","","","","","","","","","","","","","","",""
"5PXWJR58","book","2008","Stivers, Camilla.","Governance in dark times : practical philosophy for public service","","978-1-58901-334-6","","","","With the rush of calamitous events in recent years-the September 11 terror attacks, the Iraq imbroglio, and hurricanes Katrina and Rita-Americans feel themselves to be living in dark times. Trust in one another and in the government is at low ebb. People in public service face profound challenges to the meaning and efficacy of their work. Where can a public servant turn for a public philosophy to sustain practice?Inspired by Hannah Arendt and several other philosophers, Governance in Dark Times is the first book to explore the philosophical and value underpinnings needed to guide public servan","2008","2026-02-02 18:47:41","2026-02-02 18:50:56","","","","","","","","","","","","","Georgetown University Press","Washington, D.C","eng","","","","","","","Publication Title: Governance in dark times : practical philosophy for public service","","","","Public administration; Public administration – Philosophy","","","","","","","","","","","","","","","","","","","","","1st ed.","","","","","","","","","","","","","","","","","","","","","","","","","",""
"93TKLFWD","book","2018","Norris, , Trevor","Consuming Schools : Commercialism and the End of Politics","","1-4426-6030-9","","","","First linking the origins of consumerism to important political and philosophical thinkers, Trevor Norris goes on to closely examine the distinction between the public and the private sphere through the lens of twentieth-century intellectuals Hannah Arendt and Jean Baudrillard. Through Arendt's account of the human activities of labour, work, and action, and the ensuing eclipse of the public realm and Baudrillard's consideration of the visual character of consumerism, Norris examines how school commercialism has been critically engaged by in-class activities such as media literacy programs and educational policies regulating school-business partnerships.""–Pub. desc","2018","2026-02-02 18:47:41","2026-02-02 18:50:48","","","","","","","","","","","","","University of Toronto Press,","Toronto","eng","","","","","","","Publication Title: Consuming Schools : Commercialism and the End of Politics","","","","Business and education; Commercialism in schools; Consumption (Economics) – Political aspects; Consumption (Economics) – Social aspects","","","","","","","","","","","","","","","","","","","","","","","","","","","","","","","","","","","","","","","","","","","","","","",""
"NYLPWTC5","book","2020","Pettman, Dominic","The Humid Condition (More) Overheated Observations","","1-950192-72-5","","","","The Humid Condition: (More) Overheated Observations continues on the clicking heels of Dominic Pettman's Humid, All Too Humid (2016), providing a companion volume of pithy and witty observations for our overheated age. Covering topics from pop culture to academia to romance to politics to human mortality to everything in between, this collection of pointed musings aims to amuse, edify, instruct, provoke, tease, caution, and inspire. As with the first installment, the spirit of this book represents a fusion of Montaigne and Wilde; a mashup of Adorno and Yogi Berra; a parallel channeling of Marx and Marx (both Karl and Groucho). No doubt, Hannah Arendt would be appalled at the irreverence on display within these pages. Then again, “Heidegger has left the bildung.” And as the author himself notes: “I have nothing new to say. And I'm saying it!”","2020","2026-02-02 18:47:41","2026-02-02 18:52:46","","","","","","","","","","","","","punctum books","Brooklyn, NY","und;eng","","","","","","","","","","","Literature (General)","","","","","","","","","","","","","","","","","","","","","","","","","","","","","","","","","","","","","","","","","","","","","","",""
"FJYBVUK3","book","2011","Allen, Felicity","Education","","978-0-262-51636-5","","","","This title presents an anthology of texts which frames the recent educational turn in the arts within a wider historical and social context","2011","2026-02-02 18:47:41","2026-02-02 18:50:51","","","","","","","","","Documents of contemporary art","","","","Whitechapel Gallery","London","eng","","","","","","","Publication Title: Education LCCN: 2011011786","","","","Art – Study and teaching – History – 20th century; Art – Study and teaching – History – 21st century; Art and society – History – 20th century; Art and society – History – 21st century","","","","","","","","","","","","","","","","","","","","","","","","","","","","","","","","","","","","","","","","","","","","","","",""
"FJB6HJ3G","book","2023","Culp, Julian; Drerup, Johannes; Yacek, Douglas W.","The Cambridge handbook of democratic education","","978-1-009-07153-6","","","https://go.openathens.net/redirector/wcu.edu?url=https://www.cambridge.org/core/books/cambridge-handbook-of-democratic-education/C7909F00E17CC7FEE24B2C139D65250A","""The Cambridge Handbook of Democratic Education What kind of education is needed for democracy? How can education respond to the challenges that current democracies face? This unprecedented Handbook offers a comprehensive overview of the most important ideas, issues, and thinkers within democratic education. Its thirty chapters are written by leading experts in the field in an accessible format. Its breadth of purpose and depth of analysis will appeal to both researchers and practitioners in education and politics. The Handbook addresses not only the historical roots and philosophical foundations of democratic education, but also engages with contemporary political issues and key challenges to the project of democratic education.""– Provided by publisher.","2023","2026-02-02 18:47:41","2026-02-02 18:51:38","","","","","","","","","Cambridge Handbooks in Education.","","","","Cambridge University Press","Cambridge, United Kingdom ;","eng","","","","","","","Publication Title: The Cambridge handbook of democratic education LCCN: 2022050939","","","","Democracy and education; Education – Aims and objectives","","","","","","","","","","","","","","","","","","","","","","","","","","","","","","","","","","","","","","","","","","","","","","",""
"FQFF5BHN","book","2022","Wilkinson, Alissa","Salty : lessons on eating, drinking, and living from revolutionary women","","978-1-5064-7355-0","","","","""If you could have a dinner party with anyone dead or alive, who would it be? That's the question film critic and food writer Alissa Wilkinson answered as she gathered a hypothetical table of women who challenged norms and defied conventional wisdom. Ella Baker, Alice B. Toklas, Hannah Arendt, Octavia Butler, Agnes Varda, Elizabeth David, Edna Lewis, Maya Angelou, Laurie Colwin: these smart, engaging, revolutionary, and creative twentieth-century women were all profoundly influenced by their own relationships to food, drink, and other elements of sustenance. In Salty, Wilkinson explores the ways food managed to root these women into their various callings. For some, it was cultivating perseverance in the face of hardship. For others, it was nurturing a freedom to act, even in the face of opposition, toward justice and equality. For others, it was an examination of what it means to be human with all its desire, heartbreak, sacrifice, isolation, and liberty. Salty is Alissa Wilkinson's invitation to you. Join these sharp, empowered, and often subversive women and discover how to live with courage, agency, grace, smarts, snark, saltiness, and sometimes feasting–even in uncertain times. Ultimately you will leave this table with a greater understanding of food, drink, gathering, thinking, loving, and navigating the world.""– Provided by publisher","2022","2026-02-02 18:47:42","2026-02-02 18:51:30","","","","","","","","","","","","","Broadleaf Books, an imprint of 1517 Media","Minneapolis, MN","eng","","","","","","","Publication Title: Salty : lessons on eating, drinking, and living from revolutionary women","","","","Dinners and dining – History; Food – Social aspects; Food habits; Food writing; Women – Conduct of life; Women$$QWomen – Biography","","","","","","","","","","","","","","","","","","","","","","","","","","","","","","","","","","","","","","","","","","","","","","",""
"HSFG59BY","book","2004","Benhabib, Seyla","The rights of others : aliens, residents and citizens","","1-107-16062-6","","","","The Rights of Others examines the boundaries of political community by focusing on political membership - the principles and practices for incorporating aliens and strangers, immigrants and newcomers, refugees and asylum seekers into existing polities. Boundaries define some as members, others as aliens. But when state sovereignty is becoming frayed, and national citizenship is unravelling, definitions of political membership become much less clear. Indeed few issues in world politics today are more important, or more troubling. In her Seeley Lectures, the distinguished political theorist Seyla Benhabib makes a powerful plea, echoing Immanuel Kant, for moral universalism and cosmopolitan federalism. She advocates not open but porous boundaries, recognising both the admittance rights of refugees and asylum seekers, but also the regulatory rights of democracies. The Rights of Others is a major intervention in contemporary political theory, of interest to large numbers of students and specialists in politics, law, philosophy and international relations.","2004","2026-02-02 18:47:42","2026-02-02 18:52:53","","","","","","","","","The Seeley lectures ; 5","","","","Cambridge University Press","Cambridge","eng","","","","","","","Publication Title: The rights of others : aliens, residents and citizens","","","","Citizenship; Emigration and immigration; Immigrants – Civil rights; Internationalism; Noncitizens – Civil rights; Political rights; Refugees – Civil rights","","","","","","","","","","","","","","","","","","","","","","","","","","","","","","","","","","","","","","","","","","","","","","",""
"45SL89A5","book","2016","Gordon, Mordechai","Existential philosophy and the promise of education : learning from myths and metaphors","","978-1-4331-3032-8","","","","","2016","2026-02-02 18:47:42","2026-02-02 18:50:53","","","","","","","","","","","","","Peter Lang","New York","eng","","","","","","","Publication Title: Existential philosophy and the promise of education : learning from myths and metaphors LCCN: 2015036103","","","","Education – Philosophy; Existentialism","","","","","","","","","","","","","","","","","","","","","","","","","","","","","","","","","","","","","","","","","","","","","","",""
"Q8I6BALQ","journalArticle","2020","Saner, Göze","Exercising Freedom: An Arendtian clown training utopia","Performance research","","1352-8165","","","Göze Saner's 'Exercising Freedom: An Arendtian clown training utopia' proposes a performance pedagogy that consists in exercises of/for freedom. Steering clear of approaches to training that claim to free a performer's body or voice, Saner instead offers a close reading of political philosopher Hannah Arendt's theatrical understanding of freedom and political action (particularly 'Action' in The Human Condition and ""What is Freedom?"" in Between Past and Future) to extract the skills and qualities required of an actor to publicly perform an action that is 'wholly unexpected and unforeseen' (Arendt 1960: 43), make a new beginning, reveal who they are as well as the cracks in systems that appear unchangeable and bring about the experience of freedom, not only for themselves, but also, and more importantly, for the witnesses. How does one train to perform the event of freedom in the Arendtian sense? Following the image of Greta Thunberg on her first school strike, the article investigates how a personal action can resonate historically and incite collective activism. Given the unique relationship between a single performer and multiple spectators, the solo genre resonates with Arendt's description of freedom; however, it also raises specific challenges-particularly with respect to the neoliberalist celebration of a different kind of individual freedom and its influence on solo performance as a paradigm. Touching briefly upon solo documentary performance and solo autobiographical performance, the article arrives at clowning, as a solo form of training, acting and relating. Analysing Avner Eisenberg's clown pedagogy as well as Alison Hodge's core training, viewed here as clown training insofar as the ensemble becomes a space for solo emergence, the article formulates a training utopia that exercises-that is, rehearses, practises, educates, keeps working-an Arendtian freedom in action and thereby extends an invitation for all to be a Greta Thunberg.","2020","2026-02-02 18:47:42","2026-02-02 18:47:42","","146-154","","8","25","","","","","","","","Routledge","","eng","2021 The Author(s). Published by Informa UK Limited, trading as Taylor & Francis Group. 2021","","","","","","","","","","","","","","","","","","","","","","","","","","","","","","","","","","","","","","","","","","","","","","","","","","","","","","","","",""
"CZ6UDB7Z","bookSection","2018","Gunter, Helen M","Action: professionals learning to labour","The Politics of Public Education","1-4473-3958-4","","","","This chapter suggests that the combination of the ‘uncommon’ knowledges for and about the curriculum and teacher readies both for schools as businesses, where data on pupil outcomes has come to dominate the design and delivery of the curriculum and pedagogy for a segregated marketplace. Core to this has been a shift in accountability away from collegiality and peer review towards data-determined performance measurement as competent teaching. Teachers and teaching are now directly implicated in the construction and maintenance of sectarian divides based on uncommon knowledges. The chapter explores these trends using Hannah Arendt's identification of labour, work, and action. It first outlines her ideas before critically engaging with the notion and realities of performance accountability.","2018","2026-02-02 18:47:42","2026-02-02 18:47:42","","","","","","","","","","","","","Policy Press","","eng","","","","","","","","","","","curriculum; Educational Strategies and Policy; Hannah Arendt; performance accountability; performance measurement; teachers; teaching","","","","","","","","","","","","","","","","","","","","","","","","","","","","","","","","","","","","","","","","","","","","","","",""
"BBYRTTZF","journalArticle","2024","Charman, Karen","Knowledge in the public realm – the educative agent","Qualitative research journal","","1443-9883","","","PurposeThe purpose of the project was to intervene in a deficit reading of communities. This article engages public pedagogy in a way that suggests a new approach to the field. To this end, both the terms public and pedagogy are interrogated.Design/methodology/approachThe approach in this paper is an analysis of a qualitative research project: the knowledge project and pop-up school. The theoretical framework used to undertake the analysis of this project is Hannah Arendt's conceptualisation of the public realm and Michele Foucault's use of parrhesia (the truth teller), alongside Foucault's work on power.FindingsThis article offers a whole new subject position that of the educative agent. Further, this article suggests that the educative agent takes a carriage of knowledge and therefore enacts authority.Originality/valueThis article is an original theoretical engagement with knowledge, authority and power.","2024","2026-02-02 18:47:42","2026-02-02 18:47:42","","80-89","","1","24","","","","","","","","Emerald Publishing Limited","Armidale","eng","Emerald Publishing Limited","","","","","","","","","","Core curriculum; Curricula; Economics; Education; Educational Attainment; Educational Experience; Geographic Location; Knowledge; Literacy; Numeracy; Reading; Recognition (Achievement); Research Projects; Speech; Teaching","","","","","","","","","","","","","","","","","","","","","","","","","","","","","","","","","","","","","","","","","","","","","","",""
"JI9UV72X","journalArticle","2017","BERGDAHL, LOVISA; LANGMANN, ELISABET","‘Where are You?’ Giving Voice to the Teacher by Reclaiming the Private/Public Distinction","Journal of philosophy of education","","0309-8249","","","In a time of cultural pluralism and legitimation crisis (Habermas), there is an increasing uncertainty among teachers in Sweden about with what right they are fostering other people's children. What does it mean to teach ‘common values’ to the coming generation? How do teachers find legitimacy and authority for this endeavour, not as family members or as politicians, but as teachers? To respond to this uncertainty, the paper takes the public/private distinction as a starting‐point for rethinking the place of the school. Drawing on the work of Hannah Arendt and of Jan Masschelein and Maarten Simons, it argues that the school is an in‐between place—a place that transforms values into ‘common goods’ and turns fostering into a teaching matter. The overall purpose of the paper is to sketch out the consequences of this ‘in‐betweenness’ for what it means to find one's voice as a teacher in fostering the coming generation.","2017","2026-02-02 18:47:42","2026-02-02 18:47:42","","461-475","","2","51","","","","","","","","Wiley","HOBOKEN","eng","2017 The Philosophy of Education Society of Great Britain.","","","","","","","","","","Teaching; Cultural Pluralism; Education & Educational Research; Educational philosophy; Educational Practices; Foreign Countries; Habermas Jurgen; History Of Social Sciences; Legitimacy; Legitimation; Multiculturalism & pluralism; Pedagogy; Private schools; Relatives; Role of Education; School Role; Social Sciences; Social Sciences - Other Topics; Teacher Empowerment; Teacher Role; Teachers; Uncertainty; Values; Values Education","","","","","","","","","","","","","","","","","","","","","","","","","","","","","","","","","","","","","","","","","","","","","","",""
"79LH5ZHP","book","2011","Higgins, Chris","The Good Life of Teaching: An Ethics of Professional Practice","","978-1-4443-4651-0","","","","The Good Life of Teaching extends the recent revival of virtue ethics to professional ethics and the philosophy of teaching. It connects long-standing philosophical questions about work and human growth to questions about teacher motivation, identity, and development. * Makes a significant contribution to the philosophy of teaching and also offers new insights into virtue theory and professional ethics * Offers fresh and detailed readings of major figures in ethics, including Alasdair MacIntyre, Charles Taylor, and Bernard Williams and the practical philosophies of Hannah Arendt, John Dewey and Hans-Georg Gadamer * Provides illustrations to assist the reader in visualizing major points, and integrates sources such as film, literature, and teaching memoirs to exemplify arguments in an engaging and accessible way * Presents a compelling vision of teaching as a reflective practice showing how this requires us to prepare teachers differently","2011","2026-02-02 18:47:42","2026-02-02 18:47:42","","","","","18","","","","The Journal of philosophy of education book series","","","","Wiley","Newark","eng","","","","","","","","","","","Education; Teaching; Moral and ethical aspects","","","","","","","","","","","","","","","","","","","","","1","","","","","","","","","","","","","","","","","","","","","","","","","",""
"KZBA8QK3","journalArticle","2011","Lee, Mun Yee","The Pursuit of Memory: Examining Art Teaching and Pedagogical Practices through Hannah Arendt's Actor-Spectator Theory/À la recherche de la mémoire : étude de l'enseignement des arts et des pratiques pédagogiques en fonction de la théorie « acteur-spectateur » de Hanna Arendt","Canadian review of art education, research and issues","","0706-8107","","","","2011","2026-02-02 18:47:42","2026-02-02 18:47:42","","33-","","","38","","","","","","","","Canadian Society for Education Through Art","St. Catharines","eng","Copyright Canadian Society for Education Through Art 2011","","","","","","","","","","Pedagogy; Art education; Art teachers; Memory","","","","","","","","","","","","","","","","","","","","","","","","","","","","","","","","","","","","","","","","","","","","","","",""
"6B9L2NU5","journalArticle","2005","O’Byrne, Anne","Pedagogy without a Project: Arendt and Derrida on Teaching, Responsibility and Revolution","Studies in philosophy and education","","0039-3746","","","","2005","2026-02-02 18:47:43","2026-02-02 18:47:43","","389-409","","5","24","","","","","","","","Springer Nature B.V","Dordrecht","eng","Springer 2005","","","","","","","","","","Arendt Hannah; Education; Teaching; Pedagogy; Authority; Derrida Jacques; Modernity; Professors; Scientific communities; Universities","","","","","","","","","","","","","","","","","","","","","","","","","","","","","","","","","","","","","","","","","","","","","","",""
"G4E9C2L3","journalArticle","2019","KORSGAARD, MORTEN TIMMERMANN","Diving for Pearls. Thoughts on Pedagogical Practice and Theory","Journal of philosophy of education","","0309-8249","","","In this paper, the notion of pearl diving as a metaphor for historical methodology is explored as a possible conceptual contribution to pedagogical thinking and practice. Pearl diving in the thinking of Hannah Arendt and Walter Benjamin refers to a process of bringing to life and coming to terms with a fragmented past, and requires of the thinker a form of Homeric impartiality. This they contrast with the processual and functional modern understanding of historiography, where events and things are subsumed by a causal linearity. According to Arendt and Benjamin, our past cannot be understood as though in one piece, but should rather be engaged as fragmented and crystallised into events—or pearls—which can be retrieved and can help us to illuminate our past and to understand our present. This paper considers what such an approach would entail for pedagogical theory and practice, as well as for the work of the pedagogical thinker and the teacher.","2019","2026-02-02 18:47:43","2026-02-02 18:47:43","","180-199","","1","53","","","","","","","","Wiley","HOBOKEN","eng","2018 The Philosophy of Education Society of Great Britain.","","","","","","","","","","Hannah Arendt; Education; Teaching; Education & Educational Research; Educational Practices; History Of Social Sciences; Pedagogy; Social Sciences; Social Sciences - Other Topics; Educational Philosophy; Educational Theories; Educational theory; Figurative Language; Historiography; Pearl Diving; Philosophy of education; Teaching Methods; Walter Benjamin","","","","","","","","","","","","","","","","","","","","","","","","","","","","","","","","","","","","","","","","","","","","","","",""
