"Key","Item Type","Publication Year","Author","Title","Publication Title","ISBN","ISSN","DOI","Url","Abstract Note","Date","Date Added","Date Modified","Access Date","Pages","Num Pages","Issue","Volume","Number Of Volumes","Journal Abbreviation","Short Title","Series","Series Number","Series Text","Series Title","Publisher","Place","Language","Rights","Type","Archive","Archive Location","Library Catalog","Call Number","Extra","Notes","File Attachments","Link Attachments","Manual Tags","Automatic Tags","Editor","Series Editor","Translator","Contributor","Attorney Agent","Book Author","Cast Member","Commenter","Composer","Cosponsor","Counsel","Interviewer","Producer","Recipient","Reviewed Author","Scriptwriter","Words By","Guest","Number","Edition","Running Time","Scale","Medium","Artwork Size","Filing Date","Application Number","Assignee","Issuing Authority","Country","Meeting Name","Conference Name","Court","References","Reporter","Legal Status","Priority Numbers","Programming Language","Version","System","Code","Code Number","Section","Session","Committee","History","Legislative Body"
"CNFPKHQS","bookSection","2018","Ramaekers, Stefan","Love for the World in Education","Manifesto for a Post-Critical Pedagogy","1-947447-38-6","","","","In my response, I will not go into the manifesto as such, or as a whole. I will limit myself to responding to the authors’ claim that “[w]hen we truly love the world, our world, we must be willing to pass it on to the new generation,” which is a reference to (a short transcription of) Hannah Arendt’s (by now, I guess) famous passage where she brings together education and love for the world: “Education is the point at which we decide whether we love the world enough to assume responsibility for it and by the same token save it","2018","2026-02-02 18:47:39","2026-02-02 18:51:27","","63-","","","","","","","","","","","punctum books","","eng","2017 the editors and authors","","","","","","","","","","","","","","","","","","","","","","","","","","","","","","","","","","","","","","","","","","","","","","","","","","","","","","","","",""
"XJCVCJBN","book","1979","Arendt, Hannah; Hill, Melvyn A.","Hannah Arendt, the recovery of the public world","","0-312-36071-1","","","","","1979","2026-02-02 18:47:39","2026-02-02 18:51:13","","","","","","","","","","","","","St. Martin's Press","New York","eng","","","","","","","Publication Title: Hannah Arendt, the recovery of the public world LCCN: 78019393","","","","Arendt Hannah 1906-1975; Political science","","","","","","","","","","","","","","","","","","","","","","","","","","","","","","","","","","","","","","","","","","","","","","",""
"RB2I4QA4","book","2018","Kristeva, , Julia; Collins, Frank","Hannah Arendt : Life is a Narrative","","1-282-01435-8","","","","""In this volume, based on the series of Alexander Lectures she delivered at the University of Toronoto, Julia Kristeva explores the philosophical aspects of Hannah Arendt's work: her understanding of such concepts as language, self, body, political space, and life. Kristeva's aim is to clarify contradictions in Arendt's thought as well as correct misapprehensions about her political and philosophical views.""–Jacket","2018","2026-02-02 18:47:39","2026-02-02 18:50:59","","","","","","","","","Alexander Lectures","","","","University of Toronto Press,","Toronto","eng","","","","","","","Publication Title: Hannah Arendt : Life is a Narrative","","","","Arendt Hannah 1906-1975; DISCOUNT-C","","","","","","","","","","","","","","","","","","","","","","","","","","","","","","","","","","","","","","","","","","","","","","",""
"24RX5BR2","book","2002","Hull, Margaret Betz","The hidden philosophy of Hannah Arendt","","0-203-22067-6","","","","The central argument of this book is that Hannah Arendt's deserved place in the history of Western philosophy has been overlooked, and recognition of her contribution is long overdue. In part a result of Arendt's own insistence on calling herself a 'political thinker' throughout her career, this is also due to a common tendency in philosophy to denigrate the political. This book explores the indisputable philosophical dimensions of her work. In particular, it examines Arendt's theoretical commitment to recognizing humanity as a plurality, which avoids the common mistake in Western philosophy o","2002","2026-02-02 18:47:39","2026-02-02 18:51:42","","","","","","","","","RoutledgeCurzon Jewish philosophy series","","","","RoutledgeCurzon","London ;","eng","","","","","","","Publication Title: The hidden philosophy of Hannah Arendt","","","","Arendt Hannah 1906-1975","","","","","","","","","","","","","","","","","","","","","","","","","","","","","","","","","","","","","","","","","","","","","","",""
"ALHT3BEH","book","2010","Berkowitz, Roger; Katz, Jeffrey; Keenan, Thomas","Thinking in dark times : Hannah Arendt on ethics and politics","","0-8232-4854-2","","","","Hannah Arendt is one of the most important political theorists of the 20th century. This book focuses on how, against the professionalized discourses of theory, Arendt insists on the greater political importance of the ordinary activity of thinking.","2010","2026-02-02 18:47:39","2026-02-02 18:52:59","","","","","","","","","","","","","Fordham University Press","New York","eng","","","","","","","Publication Title: Thinking in dark times : Hannah Arendt on ethics and politics","","","","Arendt Hannah 1906-1975 – Political and social views; Political ethics; Political science – Philosophy","","","","","","","","","","","","","","","","","","","","","1st ed.","","","","","","","","","","","","","","","","","","","","","","","","","",""
"EHNUHPD9","book","2022","Hermsen, Joke J.; Monaghan, Brendan","A good and dignified life : the political advice of Hannah Arendt and Rosa Luxemburg","","0-300-26494-1","","","","January 2019 marked the centenary of the murder of Rosa Luxemburg, a Polish-German revolutionary whose actions provided long-lasting contributions to political philosophy and whose ideas on citizen councils, participative democracy, and imperialist capitalism greatly influenced Hannah Arendt's life and thought. In this book, Joke J. Hermsen explores the ways in which Luxemburg's life shaped Arendt's philosophy, and she investigates how the insights of both Luxemburg and Arendt may help us move toward a more sustainable and just contemporary society.0 Hermsen tracks the feminist underpinnings of radical politics in the twentieth century through the lives of these two women; how the tragic ending of Rosa Luxemburg's life and Arendt's keen empathy for her legacy provide poignant inspiration. In the end, this book dramatizes the challenges put to us through these women's works: What is it to be a human being? How do we lead a good and dignified life?","2022","2026-02-02 18:47:39","2026-02-02 18:47:39","","","","","","","","","A Margellos World Republic of Letters Book","","","","Yale University Press","New Haven, Connecticut","eng","","","","","","","Publication Title: A good and dignified life : the political advice of Hannah Arendt and Rosa Luxemburg","","","","Arendt Hannah 1906-1975 – Political and social views; Luxemburg Rosa 1871-1919 – Political and social views; Political and social views","","","","","","","","","","","","","","","","","","","","","","","","","","","","","","","","","","","","","","","","","","","","","","",""
"ILJQEIWZ","book","2012","McCarthy, Michael H.","The political humanism of Hannah Arendt","","979-8-216-29191-6","","","","This critical study of Arendt explores the sources and dangers of political alienation in the West from the citizen republics of classical antiquity to the consumer societies of modern liberal democracies. It is a sympathetic appraisal of the high promise and great perils of the political life (the bios politikos).","2012","2026-02-02 18:47:39","2026-02-02 18:52:48","","","","","","","","","","","","","Lexington Books","Lanham, Md","eng","","","","","","","Publication Title: The political humanism of Hannah Arendt LCCN: 2012021598","","","","Arendt Hannah 1906-1975 – Political and social views; Humanism","","","","","","","","","","","","","","","","","","","","","","","","","","","","","","","","","","","","","","","","","","","","","","",""
"SIVDY4KX","book","2002","Hull, Margaret Betz","The hidden philosophy of Hannah Arendt","","0-7007-1704-8","","","","","2002","2026-02-02 18:47:40","2026-02-02 18:52:43","","","","","","","","","RoutledgeCurzon Jewish philosophy series","","","","RoutledgeCurzon","London ;","eng","","","","","","","Publication Title: The hidden philosophy of Hannah Arendt LCCN: 2002069861","","","","Arendt Hannah 1906-1975; Arendt Hannah","","","","","","","","","","","","","","","","","","","","","","","","","","","","","","","","","","","","","","","","","","","","","","",""
"YWNZ2R9G","book","2016","Sigwart, Hans-Jörg; service), SpringerLink (Online","The Wandering Thought of Hannah Arendt","","978-1-137-48215-0","","","https://go.openathens.net/redirector/wcu.edu?url=http://link.springer.com/book/10.1057/978-1-137-48215-0","This book interprets Hannah Arendt’s work as a “wandering” type of political theory. Focusing on the sub-text of Arendt’s writings which questions “how to think” adequately in political theory whilst categorically refraining from explicitly investigating meta-theoretical questions of epistemology and methodology, the book characterizes her theorizing as an oscillating movement between the experiential positions of philosophy and politics, and by its distinctly multi-contextual perspective. In contrast to the “not of this world” attitude of philosophy, the book argues that Arendt’s political theory is “of this world”. In contrast to politics, it refrains from being “at home” in any particular part of this world and instead wanders between the multiple horizons of the many different political worlds in time and space. The book explores how these two decisive motives of Arendt’s theoretical self-perception majorly influence her epistemological, methodological and normative frame of reference and inspire her understanding of major concepts, including politics, judgment, understanding, nature, and space. Hans-Jörg Sigwart is Senior Lecturer in Political Theory at the University of Erlangen-Nuremberg, Germany. He has held guest professorships, fellowships and research visits at Central European University, Budapest, Hungary; Duke University, USA; Hoover Institute at Stanford University, USA; Louisiana State University USA; University of Darmstadt, Germany; and, University of Damascus, Syria. His publications include books on the political thought of Hannah Arendt, John Dewey, and Eric Voegelin.","2016","2026-02-02 18:47:40","2026-02-02 18:52:56","","","","","","","","","Global Political Thinkers","","","","Palgrave Macmillan UK","London","eng","","","","","","","","","","","Political science; Political science – Philosophy; Political Philosophy; Political Science and International Relations; Political Theory","","","","","","","","","","","","","","","","","","","","","","","","","","","","","","","","","","","","","","","","","","","","","","",""
"D45LHUKC","book","2008","Murchland, Bernard","The arrow that flies by day : existential images of the human condition from Socrates to Hannah Arendt : a philosophy for dark times","","978-0-7618-4042-8","","","","","2008","2026-02-02 18:47:40","2026-02-02 18:51:33","","","","","","","","","","","","","University Press Of America","Lanham, Md","eng","","","","","","","Publication Title: The arrow that flies by day : existential images of the human condition from Socrates to Hannah Arendt : a philosophy for dark times LCCN: 2008922491","","","","Existentialism – History","","","","","","","","","","","","","","","","","","","","","","","","","","","","","","","","","","","","","","","","","","","","","","",""
"F5RV5KYL","book","2009","Fry, Karin A.","Arendt : a guide for the perplexed","","9786612871252","","","","Hannah Arendt is considered to be one of the most influential political thinkers of the twentieth century. Although her writing is somewhat clear, the enormous breadth of her work places particular demands on the student coming to her thought for the first time. Arendt: A Guide for the Perplexed provides a clear, concise and accessible introduction to this hugely important political thinker. The book examines the most important themes of Hannah Arendt's work, as well as the main controversies surrounding it. Karin Fry explores the systematic nature of Arendt's political thought that arose in r","2009","2026-02-02 18:47:40","2026-02-02 18:50:40","","","","","","","","","Continuum guides for the perplexed","","","","Continuum","London ;","eng","","","","","","","Publication Title: Arendt : a guide for the perplexed","","","","Arendt Hannah 1906-1975","","","","","","","","","","","","","","","","","","","","","1st ed.","","","","","","","","","","","","","","","","","","","","","","","","","",""
"SL9P35DD","book","2015","Sjöholm, Cecilia; Hamm, Lisa","How to see things : doing aesthetics with Arendt","","978-0-231-53990-6","","","","Cecilia Sjöholm reads Hannah Arendt as a philosopher of the senses, grappling with questions of vision, hearing, and touch even in her political work. Constructing an Arendtian theory of aesthetics from the philosopher's fragmentary writings on art and perception, Sjöholm begins a vibrant new chapter in Arendt scholarship that expands her relevance for contemporary philosophers. Arendt wrote thoughtfully about the role of sensibility and aesthetic judgment in political life and on the power of art to enrich human experience. Sjöholm draws a clear line from Arendt's consideration of these subjects to her reflections on aesthetic encounters and works of art mentioned in her published writings and stored among her memorabilia. This delicate effort allows Sjöholm to revisit Arendt's political concepts of freedom, plurality, and judgment from an aesthetic point of view and incorporate Arendt's insight into current discussions of literature, music, theater, and visual art. Though Arendt did not explicitly outline an aesthetics, Sjöholm's work substantively incorporates her perspective into contemporary reckonings with radical politics and their relationship to art.","2015","2026-02-02 18:47:40","2026-02-02 18:51:18","","","","","","","","","Columbia Themes in Philosophy, Social Criticism, and the Arts","","","","Columbia University Press","New York, [New York","eng","","","","","","","Publication Title: How to see things : doing aesthetics with Arendt","","","","Arendt Hannah 1906-1975; Aesthetics; Art – Philosophy","","","","","","","","","","","","","","","","","","","","","","","","","","","","","","","","","","","","","","","","","","","","","","",""
"EPBU7MHJ","book","2006","Young-Bruehl, Elisabeth.","Why Arendt matters","","1-281-72304-5","","","","Upon publication of her ""field manual,"" The Origins of Totalitarianism, in 1951, Hannah Arendt immediately gained recognition as a major political analyst. Over the next twenty-five years, she wrote ten more books and developed a set of ideas that profoundly influenced the way America and Europe addressed the central questions and dilemmas of World War II. In this concise book, Elisabeth Young-Bruehl introduces her mentor's work to twenty-first-century readers. Arendt's ideas, as much today as in her own lifetime, illuminate those issues that perplex us, such as totalitarianism, terrorism, globalization, war, and ""radical evil. ""Elisabeth Young-Bruehl, who was Arendt's doctoral student in the early 1970's and who wrote the definitive biography of her mentor in 1982, now revisits Arendt's major works and seminal ideas. Young-Bruehl considers what Arendt's analysis of the totalitarianism of Nazi Germany and the Stalinist Soviet Union can teach us about our own times, and how her revolutionary understanding of political action is connected to forgiveness and making promises for the future. The author also discusses The Life of the Mind, Arendt's unfinished meditation on how to think about thinking. Placed in the context of today's political landscape, Arendt's ideas take on a new immediacy and importance. They require our attention, Young-Bruehl shows, and continue to bring fresh truths to light.","2006","2026-02-02 18:47:40","2026-02-02 18:53:08","","","","","","","","","Why X matters","","","","Yale University Press","New Haven","eng","","","","","","","Publication Title: Why Arendt matters LCCN: 2006018235","","","","Arendt Hannah 1906-1975 – Political and social views; Political science – Philosophy; Totalitarianism","","","","","","","","","","","","","","","","","","","","","1st ed.","","","","","","","","","","","","","","","","","","","","","","","","","",""
"ZRI8EI9X","book","2017","Cochran, Patricia","Common sense and legal judgment : community knowledge, political power, and rhetorical practice","","978-0-7735-5231-9","","","","What does it mean when a judge in a court of law uses the phrase “common sense”? Is it a type of evidence or a mode of reasoning? In a world characterized by material and political inequalities, whose common sense should inform the law? Common Sense and Legal Judgment explores this rhetorically powerful phrase, arguing that common sense, when invoked in political and legal discourses without adequate reflection, poses a threat to the quality and legitimacy of legal judgment. Often operating in the service of conservatism, populism, or majoritarianism, common sense can harbour stereotypes, reproduce unjust power relations, and silence marginalized people. Nevertheless, drawing the works of theorists such as Thomas Reid, Antonio Gramsci, and Hannah Arendt into conversation with rulings by the Supreme Court of Canada, Patricia Cochran demonstrates that with careful attention, the democratic, egalitarian, and community-sustaining aspects of common sense can be brought to light. A call for critical self-reflection and the close scrutiny of power relationships and social contexts, this book is a direct response to social justice predicaments and their confounding relationships to law. Creative and interdisciplinary, Common Sense and Legal Judgment reinvigorates feminist and anti-poverty understandings of judgment, knowledge, justice, and accountability.","2017","2026-02-02 18:47:40","2026-02-02 18:50:45","","","","","","","","","","","","","McGill-Queen's University Press","Montreal, [Quebec Province","eng","","","","","","","Publication Title: Common sense and legal judgment : community knowledge, political power, and rhetorical practice","","","","Common sense; Judgment; Justice","","","","","","","","","","","","","","","","","","","","","1st ed.","","","","","","","","","","","","","","","","","","","","","","","","","",""
"CTYL3FPH","book","2019","Reinhardt, , Mark","The Art of Being Free : Taking Liberties with Tocquevile, Marx, and Arendt","","978-1-5017-4306-1","","","","The ""art of being free"" is an essential part of democracy. It involves, Mark Reinhardt believes, bringing into being the multiple spaces in and practices through which individuals and groups help to constitute their lives, their selves, their worlds. Americans are presently witnessing a contraction of officially sanctioned spaces for citizen action. It is now crucial, Reinhardt argues, to identify ways of opening new spaces for the direct practice of democratic politics.Reinhardt treats the writings of Alexis de Tocqueville, Karl Marx, and Hannah Arendt as exemplary sources for an expansion of political possibility. These writers indicate where and how the new spaces can be brought into being, and they reveal acts of making space as some of the prime moments of politics. Reinhardt's extended readings of these writers, never previously treated together, are quite unlike the familiar understandings of their thought. ""Taking liberties,"" he brings the literary and political sensibility usually associated with postmodernism to a sympathetic if critical encounter with eminently modern thinkers. The result is a strong and idiosyncratic book, accessible and stylish, that mixes acute readings of canonical thinkers with more practical applications and illustrations. Reinhardt combines attention to textual detail and nuance with concern for contemporary politics, discussing as an unusually inventive example the AIDS activist group ACT UP.","2019","2026-02-02 18:47:40","2026-02-02 18:51:36","","","","","","","","","Contestations","","","","Cornell University Press,","Ithaca, NY","eng","","","","","","","Publication Title: The Art of Being Free : Taking Liberties with Tocquevile, Marx, and Arendt","","","","Arendt Hannah 1906-1975; Marx Karl 1818-1883; PHILOSOPHY / Free Will & Determinism; Tocqueville Alexis de 1805-1859","","","","","","","","","","","","","","","","","","","","","1st ed.","","","","","","","","","","","","","","","","","","","","","","","","","",""
"SGI8LG93","book","1968","Benjamin, Walter","Illuminations.","","","","","","","1968","2026-02-02 18:47:40","2026-02-02 18:51:21","","","","","","","","","","","","","Harcourt, Brace & World","New York","eng","","","","","","","LCCN: 68024382 //r873","","","","Literature – History and criticism","","","","","","","","","","","","","","","","","","","","","[1st ed.]","","","","","","","","","","","","","","","","","","","","","","","","","",""
"T2NWCARP","book","2018","Gunter, Helen","The politics of public education : reform ideas and issues","","978-1-4473-3960-1","","","","This book critically examines the key issues facing the public with implications for education policy makers, professionals and researchers, confronting current issues about social justice and segregation. The author uses Arendtian ideas to help the reader to 'think politically' about education and how public services education can be reimagined.","2018","2026-02-02 18:47:41","2026-02-02 18:52:51","","","","","","","","","Policy Press scholarship online","","","","Policy Press","Bristol","eng","","","","","","","Publication Title: The politics of public education : reform ideas and issues","","","","Arendt Hannah 1906-1975; Education and state – Philosophy","","","","","","","","","","","","","","","","","","","","","1st ed.","","","","","","","","","","","","","","","","","","","","","","","","","",""
"W384JCKX","book","2025","Rojahn, Pia","Hannah Arendts Pädagogik : Eine Bildungstheorie für die Lehrkräftebildung","","3-96665-895-X","","","","Das Buch trägt bereits im Titel seine erste These: In Hannah Arendts Werk verbirgt sich eine Pädagogik. Exemplarisch analysiert die Autorin Arendts Konzepte Natalität, Urteilskraft und (Un-)Zugehörigkeit und arbeitet ihre Bedeutung für die Erziehungswissenschaft heraus. Mit diesen Konzepten lassen sich aktuelle Entwicklungen in der Lehrkräftebildung kritisieren und zugleich sinnvolle bildungstheoretische Alternativen aufzeigen. The book's title already contains its first thesis: Hannah Arendt's work contains a pedagogy.. As an example, the author analyses Arendt's concepts of natality, power of judgement and (dis-)belonging, which are important for pedagogy and take it further. With these pedagogical elements, current developments in teacher training can be criticised and at the same time Arendt's concepts can be used to demonstrate meaningful educational theory alternatives.","2025","2026-02-02 18:47:41","2026-02-02 18:51:16","","","","","","","","","","","","","Barbara Budrich Academic Press GmbH","Leverkusen","ger","","","","","","","Publication Title: Hannah Arendts Pädagogik : Eine Bildungstheorie für die Lehrkräftebildung","","","","affiliation; Bildungstheorie; educational theory; Lehrkräftebildung; Natalität; natality; political education; politische Bildung; power of judgement; professionalism; Professionalität; teacher education; Urteilskraft; Zugehörigkeit","","","","","","","","","","","","","","","","","","","","","1st ed.","","","","","","","","","","","","","","","","","","","","","","","","","",""
"U6M5FSJM","book","2012","Nixon, Jon","Interpretive pedagogies for higher education : Arendt, Berger, Said, Nussbaum and their legacies","","978-1-4411-1715-1","","","","","2012","2026-02-02 18:47:41","2026-02-02 18:51:24","","","","","","","","","","","","","Continuum International Pub. Group","London ;","eng","","","","","","","Publication Title: Interpretive pedagogies for higher education : Arendt, Berger, Said, Nussbaum and their legacies LCCN: 2011042163","","","","Arendt Hannah 1906-1975; Berger John; Education Higher – Aims and objectives; Education Higher – Philosophy; Nussbaum Martha C (Martha Craven) 1947-; Said Edward W","","","","","","","","","","","","","","","","","","","","","","","","","","","","","","","","","","","","","","","","","","","","","","",""
"NBTVLYWC","book","2023","Gunter, Helen","A political sociology of education policy","","1-4473-6337-X","","","","This book aims to restore the role of political analysis in education policy by presenting a new political sociology for framing, conducting and presenting research. In doing so, it will be the first in the field to connect political thinking from Arendt with sociological thinking from Bourdieu.","2023","2026-02-02 18:47:41","2026-02-02 18:47:41","","","","","","","","","","","","","Policy Press","Bristol","eng","","","","","","","Publication Title: A political sociology of education policy","","","","Arendt Hannah 1906-1975; Bourdieu Pierre 1930-2002; Education – Philosophy; Education and state; Education and state – Social aspects","","","","","","","","","","","","","","","","","","","","","1st ed.","","","","","","","","","","","","","","","","","","","","","","","","","",""
